{
 "schema": "review-points/2",
 "mode": "points",
 "source": "review-points.md",
 "provenance": {
  "ticket": "victorrentea/petclinic#37",
  "base": "5dcf16c4",
  "implementation": "a8cd9973",
  "reviewers": "/code-review high",
  "session": "47d2ba31-61ef-4ef6-ac2f-7d969121ce34",
  "auditedBase": "5dcf16c4",
  "auditedHead": "a8cd9973",
  "reviewCommit": "89e013a1387a2f05b75182abde2f128261d95afa"
 },
 "fixed_in": "HEAD",
 "findings": [
  {
   "title": "Make PUT /api/visits/{id} keep the vet when the body omits vetId",
   "source": "/code-review high (the same finding, its design half)",
   "severity": "medium",
   "why": "&quot;assign only when the field is present&quot; is precisely the bug #37 tells me not to repeat.",
   "body": "The endpoint already replaces <code>date</code> and <code>description</code> unconditionally \u2014 a body without <code>date</code> nulls the date. Special-casing <code>vetId</code> would make one field in one DTO behave differently from its neighbours, and telling absent from explicit-null needs a <code>JsonNullable</code> wrapper that nothing else in this codebase uses. The ticket&#x27;s second requirement is that clearing the field sticks; unconditional assignment is what makes it stick.",
   "refs": [
    "petclinic-backend/src/main/java/victor/training/petclinic/rest/VisitRestController.java:88"
   ],
   "snippets": [
    {
     "ref": "petclinic-backend/src/main/java/victor/training/petclinic/rest/VisitRestController.java:88"
    }
   ]
  },
  {
   "title": "Collapse the duplicated attendingVet helper",
   "source": "/code-review high (duplication)",
   "severity": "low",
   "why": "three lines shared by two controllers that already duplicate the whole booking flow; the honest fix is collapsing those, which is a bigger change than #37 asks for.",
   "body": "I first wrote it as one <code>default</code> method on <code>VetRepository</code>, which is where it belongs. It fails at runtime: Spring Data&#x27;s <code>NullnessMethodInvocationValidator</code> rejects a null argument to any repository method, so &quot;no vet chosen&quot; became a 500 \u2014 and neither <code>org.springframework.lang.@Nullable</code> nor <code>org.jspecify.@Nullable</code> on the parameter talks it out of that. A <code>@Component</code> wrapping one ternary would buy less than it costs.",
   "refs": [
    "petclinic-backend/src/main/java/victor/training/petclinic/rest/OwnerRestController.java:201"
   ],
   "snippets": [
    {
     "ref": "petclinic-backend/src/main/java/victor/training/petclinic/rest/OwnerRestController.java:201"
    }
   ]
  },
  {
   "title": "A denied @PreAuthorize answers 500 instead of 403",
   "source": "me, while writing the test for the vet-picker fix",
   "severity": "medium",
   "why": "it is global error handling on every endpoint, and #37 is about a column on visits.",
   "body": "<code>handleGeneralException</code> catches <code>Exception</code>, which includes <code>AuthorizationDeniedException</code>, so every authorization failure in <code>rest/</code> is reported as an internal error \u2014 and the <code>ProblemDetail</code> echoes the exception&#x27;s own message back to the caller. Worth its own ticket. <code>ownerAdmin_cannotAddAVet</code> therefore asserts the write is refused rather than pinning the status code, so fixing this will not fail it.",
   "refs": [
    "petclinic-backend/src/main/java/victor/training/petclinic/rest/error/ExceptionControllerAdvice.java:75"
   ],
   "snippets": [
    {
     "ref": "petclinic-backend/src/main/java/victor/training/petclinic/rest/error/ExceptionControllerAdvice.java:75"
    }
   ]
  },
  {
   "title": "OwnerRestController&#x27;s constructor is now nine parameters",
   "source": "me, anticipating SonarCloud java:S107 (this repo lowers the cap to 5)",
   "severity": "low",
   "why": "it was already eight, the ninth collaborator is genuinely needed, and every alternative is worse.",
   "body": "Resolving the vet needs a repository, and <code>mapper \u2192 repository</code> is forbidden by <code>docs/packages.puml</code>. Sonar will re-flag S107 because the constructor&#x27;s lines changed, so this will show up as a new-code finding on a pre-existing violation.",
   "refs": [
    "petclinic-backend/src/main/java/victor/training/petclinic/rest/OwnerRestController.java:67"
   ],
   "snippets": [
    {
     "ref": "petclinic-backend/src/main/java/victor/training/petclinic/rest/OwnerRestController.java:67"
    }
   ]
  },
  {
   "title": "The user manual still describes the visit screens without a vet",
   "source": "me",
   "severity": "low",
   "why": "<code>manual.md</code> and its screenshots are regenerated by crawling the running UI, which needs the frontend&#x27;s dependencies installed; hand-editing the prose would leave it disagreeing with its own screenshots.",
   "refs": [
    "user-manual/manual.md:100"
   ],
   "snippets": [
    {
     "ref": "user-manual/manual.md:100"
    }
   ]
  }
 ],
 "autofixes": [
  {
   "title": "The vet picker could not load on the screens that need it",
   "source": "/code-review high (cross-role read on a widened screen)",
   "body": "<code>GET /api/vets</code> sat under the class&#x27;s <code>hasRole(VET_ADMIN)</code>, but the booking and edit forms are owner-admin screens. An owner-admin-only user opening *New Visit* got an error and a permanently empty combo \u2014 the one thing #37 asks for most. <code>PetTypeRestController</code> already solves the identical cross-role read, so this follows it, except narrower: only <code>listVets()</code> moves to <code>hasAnyRole(OWNER_ADMIN, VET_ADMIN)</code>; adding, editing and deleting vets stay VET_ADMIN.<br><br>Worth recording how the reviewer&#x27;s scenario differed from reality. It predicted a 403; the run produces a **500**, because <code>ExceptionControllerAdvice</code>&#x27;s catch-all handler swallows <code>AuthorizationDeniedException</code>. Same broken picker, uglier failure. It is also why the two new assertions live in <code>BasicAuthenticationConfigTest</code> and not next to the controller: <code>petclinic.security.enable</code> is <code>false</code> everywhere else, so every <code>@WithMockUser(roles = \u2026)</code> in the other suites decorates without enforcing, and a role test written beside <code>VetTest</code> passes whatever the rule says. The first version of this fix&#x27;s test did exactly that and proved nothing.",
   "refs": [
    "petclinic-backend/src/main/java/victor/training/petclinic/rest/VetRestController.java:50"
   ],
   "snippets": [
    {
     "ref": "petclinic-backend/src/main/java/victor/training/petclinic/rest/VetRestController.java:50"
    }
   ],
   "diffs": [
    {
     "path": "petclinic-backend/src/main/java/victor/training/petclinic/rest/VetRestController.java",
     "base": "a8cd9973"
    }
   ]
  },
  {
   "title": "Booking a visit read the vet&#x27;s whole specialty list to set one foreign key",
   "source": "/code-review high (efficiency)",
   "body": "<code>VetRepository.findById</code> <code>LEFT JOIN FETCH</code>es <code>v.specialties</code>, which is right for the vet screens and pure waste for <code>attendingVet</code>, which reads nothing off the vet but its identity. Both booking paths now use a lean <code>findByIdWithoutSpecialties</code>.",
   "refs": [
    "petclinic-backend/src/main/java/victor/training/petclinic/repository/VetRepository.java:19"
   ],
   "snippets": [
    {
     "ref": "petclinic-backend/src/main/java/victor/training/petclinic/repository/VetRepository.java:19"
    }
   ],
   "diffs": [
    {
     "path": "petclinic-backend/src/main/java/victor/training/petclinic/repository/VetRepository.java",
     "base": "a8cd9973"
    }
   ]
  },
  {
   "title": "The Cucumber update step dropped the vet out of its PUT body",
   "source": "/code-review high (the PUT-clears-the-vet scenario)",
   "body": "<code>iUpdateVisitDescription</code> rebuilt the body from the GET but stopped at <code>description</code>, so after this change renaming a visit unassigned its vet. The step now carries <code>vetId</code> through like every other field, and <code>visits.feature</code> gained the scenario that would have caught it. I kept the endpoint&#x27;s semantics (see Ignored) and fixed the client, which is where the defect actually was.",
   "refs": [
    "petclinic-backend/src/test/java/victor/training/petclinic/functional/VisitSteps.java:95"
   ],
   "snippets": [
    {
     "ref": "petclinic-backend/src/test/java/victor/training/petclinic/functional/VisitSteps.java:95"
    }
   ],
   "diffs": [
    {
     "path": "petclinic-backend/src/test/java/victor/training/petclinic/functional/VisitSteps.java",
     "base": "a8cd9973"
    }
   ]
  }
 ],
 "assumptions": [
  {
   "title": "vet_id is ON DELETE SET NULL, so deleting a vet is never blocked",
   "alternative": "the default RESTRICT \u2014 a vet who has attended anything can no longer be deleted, and <code>DELETE /api/vets/{id}</code> starts failing on real data",
   "confidence": 0.55,
   "why": "#37 says a visit with no vet is normal and &quot;never an error&quot;, so a vet&#x27;s departure landing their old visits in that case is the reading that keeps the ticket&#x27;s own rule true. RESTRICT would invent a new failure mode the ticket never asks for.",
   "decidedBy": "agent",